{
  "schema_version": "workflow.score.v1",
  "score_id": "55555555-5555-4555-8555-555555555555",
  "run_id": "22222222-2222-4222-8222-222222222222",
  "case_id": "33333333-3333-4333-8333-333333333333",
  "configuration_snapshot_id": "cfg-parser-candidate",
  "protocol_versions": {
    "run": "agent.run.v1",
    "case": "workflow.case.v1",
    "score": "workflow.score.v1"
  },
  "created_at": "2026-08-28T02:03:05Z",
  "execution": {
    "status": "completed",
    "started_at": "2026-08-28T02:00:00Z",
    "ended_at": "2026-08-28T02:03:00Z"
  },
  "task_result": {
    "status": "pass",
    "score": 1,
    "reason": "Every required objective validator passed."
  },
  "validations": [
    {
      "validator_id": "parser-unit-test",
      "status": "pass",
      "objective": true,
      "required": true,
      "duration_ms": 4300,
      "summary": "The escaped delimiter regression test passed.",
      "evidence": [
        {
          "kind": "structured",
          "summary": "One focused test passed with exit code 0.",
          "data": { "exit_code": 0, "passed": 1, "failed": 0 },
          "redacted": false
        }
      ]
    },
    {
      "validator_id": "allowed-paths",
      "status": "pass",
      "objective": true,
      "required": true,
      "duration_ms": 90,
      "summary": "Every changed path was allowed.",
      "evidence": [
        {
          "kind": "artifact",
          "summary": "The patch contains only parser package changes.",
          "ref": "artifact-patch",
          "redacted": false
        }
      ]
    }
  ],
  "trace_findings": [
    {
      "finding_id": "finding-1",
      "category": "validation",
      "severity": "info",
      "summary": "The agent ran the focused validator before finishing.",
      "event_refs": ["managed-evt-2"],
      "evidence_refs": ["artifact-patch"]
    }
  ],
  "resource_usage": {
    "duration_ms": 180000,
    "preparation_ms": 12000,
    "reset_ms": 7000,
    "agent_ms": 156000,
    "validation_ms": 5000,
    "input_tokens": 7200,
    "output_tokens": 1100,
    "monetary_cost": { "amount": 0, "currency": "USD" }
  },
  "nondeterminism": {
    "sample_count": 1,
    "single_run_evidence": true,
    "notes": ["This score is one observed sample and does not establish a stable improvement."]
  },
  "summary": "The candidate passed this single code case without changing a disallowed path."
}
